<?xml version="1.0" encoding="UTF-8"?>
<SurgeryReport xmlns:xsi="http://www.w3.org/2001/XMLSchema-instance" xsi:noNamespaceSchemaLocation="Sugeri.xsd">
    <Header>
        <InstitutionId>151</InstitutionId>
        <ReferencePeriod>2025-11</ReferencePeriod>
    </Header>
    <SurgicalData>
        
        <SurgeryEntry>
            <Specialty>Cirurgia Plástica e Reconstrutiva</Specialty>
            <serviceId>95</serviceId>
            <priority>1 - Doença não oncológica</priority>
            <WaitingListCounts>
                <General>300</General>
                <NonOncological>298</NonOncological>
                <Oncological>2</Oncological>
            </WaitingListCounts>
            <AverageWaitTimeDays>120.5</AverageWaitTimeDays>
        </SurgeryEntry>
        
    </SurgicalData>
</SurgeryReport>
